Title,Author,Abstract,Link,Number,Date,Source,est_PubDate
Semiparametric Conditional Factor Models: Estimation and Inference,"Qihui Chen, Nikolai Roussanov, Xiaoliang Wang","This paper introduces a simple and tractable sieve estimation of semiparametric conditional factor models with latent factors. We establish large-N-asymptotic properties of the estimators without requiring large T. We also develop a simple bootstrap procedure for conducting inference about the conditional pricing errors as well as the shapes of the factor loading functions. These results enable us to estimate conditional factor structure of a large set of individual assets by utilizing arbitrary nonlinear functions of a number of characteristics without the need to pre-specify the factors, while allowing us to disentangle the characteristics' role in capturing factor betas from alphas (i.e., undiversifiable risk from mispricing). We apply these methods to the cross-section of individual U.S. stock returns and find strong evidence of large nonzero pricing errors that combine to produce arbitrage portfolios with Sharpe ratios above 3. We also document a significant decline in apparent mispricing over time.",https://www.nber.org/papers/w31817,31817,23-Oct,NBER,10/30/2023
Social Insurance and Migration: Evidence from a Nation-Wide Institutional Reform in China,"Fanghua Li, Chenyang Ji, Moshe Buchinsky","In this paper we examine the causal relationship between formal social insurance and individuals’ migration decisions. We exploit a quasi experimental design in rural China, under which county officials were assigned to a group of villages (i.e., treated villages) to serve as village supervisors (VSs) for the local leaders. We show that this led to reduced favoritism in welfare allocation by the local leaders, thereby increasing the efficacy in the formal social insurance in the treated villages. We use detailed geo-referenced administrative household-level data suited for a spatial regression discontinuity design (RDD) to obtain an average treatment effect (LATE) of the improved social insurance on migration. The apparent variation in the implementation of the reform across treated villages and heterogeneous impacts on different family clans make it possible to directly link changes in the efficacy of the insurance to migration choices. We find a large positive migration effect, of about 19%, for the young males and females. In turn, this led to a large boost in the average household’s income in just two years.",https://www.nber.org/papers/w31819,31819,23-Oct,NBER,10/30/2023
"Social Unrests and Fuel Prices: The Role of Macroeconomic, Social and Institutional Factors","Alassane Drabo, Kodjovi M. Eklou, Patrick A. Imam, Kangni R Kpodar","This paper investigates the impact of fuel price increases on social unrests in addition to the macroeconomic, social and institutional factors driving this relationship. Using the IV fixed-effect estimator on a sample of 101 developing countries during 2001-2020, we find that changes in fuel prices are positively associated with the number of social unrests, mainly anti-government demonstrations. This impact is however amplified: (i) during economic downturns and periods of high exchange rate instability; (ii) when government spending is low, especially on health and education, thus suggesting that streamlining fuel subsides and diverting parts of the reform savings to the health and education sectors is an appropriate policy that could appease social tensions; (iii) in countries with high income inequality, low institutional quality and high level of corruption. The results are robust to a battery of tests, including the use of an instrumental variable approach to address reverse causality concerns given that social unrests could also prompt a freeze in fuel prices. We also find consistent results using either changes in diesel or gasoline prices. Overall, the findings of the paper provide support to the grievance and deprivation theory in explaining the association between fuel price increases and social unrests, but fail to find evidence for the resource theory and the theory of political opportunities.",https://www.imf.org/en/Publications/WP/Issues/2023/10/27/Social-Unrests-and-Fuel-Prices-The-Role-of-Macroeconomic-Social-and-Institutional-Factors-539677,WPIEA2023228,"Fri, 27 Oct 2023 ",IMF,10/30/2023
The effect of monetary policy on inflation heterogeneity along the income distribution,"Miguel Ampudia, Michael Ehrmann, Georg Strasser","This paper studies the effect of monetary policy on inflation along the income distributionin several euro area countries. It shows that monetary policy has differential effects and identifies twochannels which point in opposite directions. On the one hand, different consumption shares imply thatthe inflation experienced by high-income households responds less to monetary policy. On the otherhand, the paper provides novel evidence that there are substantial differences in shopping behaviourand its reaction to monetary policy, which imply that the inflation experienced by high-income householdsresponds more to monetary policy.",https://www.ecb.europa.eu/pub/pdf/scpwps/ecb.wp2858~bccf5beb84.en.pdf?3762af27e1f1d51e44dc5f9bde9ade59,2858,30-Oct-23,ECB,10/30/2023
The Impact of the Global COVID-19 Vaccination Campaign on All-Cause Mortality,"Virat Agrawal, Neeraj Sood, Christopher M. Whaley","The global COVID-19 vaccination campaign is the largest public health campaign in history, with over 2 billion people fully vaccinated within the first 8 months. Nevertheless, the impact of this campaign on all-cause mortality is not well understood. Leveraging the staggered rollout of vaccines, we find that the vaccination campaign across 141 countries averted 2.4 million excess deaths, valued at $6.5 trillion. We also find that an equitable counterfactual distribution of vaccines, with vaccination in each country proportional to its population, would have saved roughly 670,000 more lives. However, this distribution approach would have reduced the total value of averted deaths by $1.8 trillion due to redistribution of vaccines from high-income to low-income countries.",https://www.nber.org/papers/w31812,31812,23-Oct,NBER,10/30/2023
The Topography of Nations,Treb Allen,"How does the interplay of geography and political-economic forces affect the shape of nations? This paper presents a quantitative framework for characterizing the equilibrium evolution of national boundaries in a world with a rich geography. The framework delivers simple equilibrium conditions based on the efficient transportation of resources that arise from disparate political economic micro-foundations. I characterize the existence, uniqueness, and efficiency of the equilibrium and provide a simple algorithm for its calculation. When combined with detailed spatial geography data from Europe, the equilibrium conditions well approximate observed borders, and the framework is able to successfully predict the evolution of national boundaries and resulting conflict over the past millennia. Finally, I apply the framework to ask how the changing spatial distribution of resources arising from climate change may alter European borders in the future, finding that the Crimean peninsula and surrounding area is especially susceptible.",https://www.nber.org/papers/w31795,31795,23-Oct,NBER,10/30/2023
Using Macro Counterfactuals to Assess Plausibility: An Illustration using the 2001 Rebate MPCs,"Jacob Orchard, Valerie A. Ramey, Johannes Wieland","Macroeconomics has increasingly adopted tools from the applied micro “credibility revolution” to estimate micro parameters that can inform macro questions. In this paper, we argue that researchers should take advantage of this confluence of micro and macro to take the credibility revolution one step further. We argue that researchers should assess the plausibility of the micro estimates and macro models by constructing macro counterfactuals for historical periods and comparing these counterfactuals with reasonable benchmarks. We illustrate this approach by conducting a case study of the 2001 U.S. tax rebates, as well as briefly summarizing two previous applications of the methodology. In the 2001 rebate case, we calibrate a two-good, two-agent New Keynesian model with the leading estimates of the household marginal propensity to consume (MPC) out of the rebates to construct a counterfactual path for nondurable consumption. The counterfactual path implies that without the tax rebate nondurable consumption spending would have fallen dramatically in the late summer and fall of 2001. Using forecasting regressions and other evidence, we argue that this counterfactual is implausible. When we investigate the source of the discrepancy, we find that the leading MPC estimates are not representative of the response of total consumption.",https://www.nber.org/papers/w31808,31808,23-Oct,NBER,10/30/2023
Value Added Tax in the Extractive Industries,"Artur Swistak, Nate Vernon","Lower capacity countries often struggle to administer the Value Added Tax (VAT) in the extractive industries, partly due to the large VAT refunds needs of this capital and export-intensive sector. Assuming that the first-best policy (apply the standard VAT to the extractive industry) is not possible in the medium-term, what should countries do? This paper systemically analyzes second-best VAT policy designs considering the impact of the VAT on three key stakeholders: the investor, domestic suppliers, and the tax administration. The analysis concludes that the generally preferred policy is to provide a VAT exemption for imports and either fully tax or exempt domestic supplies, although country characteristics (and, specifically the relative weighting of stakeholders) matter. Moreover, governments should make efforts to shorten refund delays and transition to a standard VAT over the longer-term.",https://www.imf.org/en/Publications/WP/Issues/2023/10/27/Value-Added-Tax-in-the-Extractive-Industries-540826,WPIEA2023221,"Fri, 27 Oct 2023 ",IMF,10/30/2023
Wars and the Labor Market Outcomes of Minorities in the U.S.,Andreas Ferrara,"This chapter reviews key literature studying the effects of wars on minority and underrepresented groups in U.S. labor markets in the 20th century. These labor markets, characterized by historically pervasive barriers to entry into certain occupations and industries, promotions, and fair pay for underrepresented workers, experienced severe challenges during times of war. These challenges served to break down some of the barriers faced by underrepresented workers. Recent years have shown that sudden labor shortages, similar to those induced by large-scale wars, are not a feature of the past. Hence, a better understanding of such shortages and their effects on different groups continues to be important. The focus here is on the labor market outcomes of Black and white women, as well as Black men, during and after the two World Wars. Their labor inputs compensated for the lack of white male workers during the war years; however, only WWII generated significant and more prolonged socioeconomic progress for both groups. This chapter summarizes theoretical considerations that can explain why some war-induced labor market shocks are persistent while others are not, and the empirical literature related to the labor market experiences of women and Black workers during and after the World Wars.",https://www.nber.org/papers/w31811,31811,23-Oct,NBER,10/30/2023
When Institutions Interact: How the Effects of Unemployment Insurance are Shaped by Retirement Policies,"Matthew Gudgeon, Pablo Guzman, Johannes F. Schmieder, Simon Trenkle, Han Ye","This paper shows empirically that the non-employment effects of unemployment insurance (UI) for older workers depend in a first-order way on the structure of retirement policies. Using German data, we first present reduced-form evidence of these interactions, documenting large bunching in UI inflows at the age that allows workers to claim their pension following UI expiration. We then estimate a dynamic life-cycle model and use it to directly quantify how the effects of UI vary with retirement policies. Accounting for interactions across UI and retirement institutions also helps explain otherwise difficult-to-explain trends in the unemployment rate of older German workers.",https://www.nber.org/papers/w31807,31807,23-Oct,NBER,10/30/2023
Why Is Tunisia’s Unemployment So High? Evidence From Policy Factors,"Aymen Belgacem, Jérôme Vacher","Tunisia has one of the highest unemployment rates within the Middle East and Central Asia. We look at the extent to which institutional factors explain those high unemployment levels. We also assess unemployment cyclicality, by looking at the determinants of labor market sensitivity to the output gap. We find that during the last decade the deterioration of institutional factors that affect labor demand explain not only about a quarter of the unemployment rate increase in Tunisia, but also Tunisia’s excess sensitivity of unemployment to the output gap. Our results suggest that an improved business environment and product market competition, increased labor market flexibility as well as reduced financial constraints and informality would help reduce Tunisia’s unemployment.",https://www.imf.org/en/Publications/WP/Issues/2023/10/27/Why-Is-Tunisias-Unemployment-So-High-Evidence-From-Policy-Factors-539628,WPIEA2023219,"Fri, 27 Oct 2023 ",IMF,10/30/2023
Financial shock transmission to heterogeneous firms: the earnings-based borrowing constraint channel,"Livia Chiţu, Magdalena Grothe, Tatjana Schulze, Ine Van Robays","We study the heterogeneous impact of jointly identified monetary policy and global riskshocks on corporate funding costs. We disentangle these two shocks in a structural BayesianVector Autoregression framework and investigate their respective effects on funding costsof heterogeneous firms using micro-data for the US. We tease out mechanisms underlyingthe effects by contrasting financial frictions arising from traditional asset-based collateralconstraints with the recent earnings-based borrowing constraint hypothesis, differentiatingfirms across leverage and earnings. Our empirical evidence strongly supports the earnings-basedborrowing constraint hypothesis. We find that global risk shocks have stronger andmore heterogeneous effects on corporate funding costs which depend on firms’ positionwithin the earnings distribution.",https://www.ecb.europa.eu/pub/pdf/scpwps/ecb.wp2860~f13302bf4a.en.pdf?7c73a3edbba98737e1a18fbfa969364f,2860,2-Nov-23,ECB,11/2/2023
How Should Climate Change Uncertainty Impact Social Valuation and Policy?,"Michael Barnett, William Brock, Lars Peter Hansen, Hong Zhang","We study the uncertain transition to a carbon-neutral economy. The requisite technological innovation is made more probable through research and development (R&D). We explore multiple channels of economic and geoscientific uncertainties that impact this transition, and we show how to assess the relative importance of their varied contributions. We represent the social benefit of R&D and cost of global warming as expected discounted values of social payoffs using a probability measure adjusted for concerns about model misspecification and prior ambiguity. Our quantitative results show the value of R&D investment even when the timing of its technological success is highly uncertain.",https://bfi.uchicago.edu/working-paper/how-should-climate-change-uncertainty-impact-social-valuation-and-policy/,2023-140,2-Nov-23,BFI,11/2/2023
Liquidity constraints and demand for maturity the case of mortgages,"Alessandro Ferrari, Marco Loseto","Using administrative data on mortgages issued in Italy between 2018 and 2019,this paper estimates loan demand elasticities to maturity and interest rate. We findthat households are responsive to both contract terms: a 1% decrease in interestrate increases the average loan size by 0.22% whereas a commensurable increasein maturity increases loan demand by 0.30%. This evidence suggests that creditconstraints are relevant in this market. Things change substantially when movingalong the distribution of contract maturities: short term borrowers are unresponsive to their contract lengthwhile maturity elasticities are higher for long term borrowers.",https://www.ecb.europa.eu/pub/pdf/scpwps/ecb.wp2859~9fd6df6d10.en.pdf?e73f5fe9e932a3f87d984fbe237e13ac,2859,31-Oct-23,ECB,10/31/2023
China’s footprint in global financial markets,"David Lodge, Ana-Simona Manu, Ine Van Robays","Using daily data since 2017, we disentangle China-specific structural shocks driving Chinese financial markets and examine spillovers across global markets. The novelty of this paper consists of simultaneously identifying China shocks with shocksemanating from the United States and shocks to global risk sentiment – two major forces driving global financial markets – to ensure that China spillover estimates do not reflect common factors. Our results show that shocks originating in China havematerial impacts on global equity markets, although spillovers are much smaller than those following shocks in the United States, or those triggered by shifts in global risk sentiment. By contrast, shocks from China account for a significant proportion of variation in global commodity prices, more on a par with those of the United States. Nevertheless, spillovers from China can be significantly amplified in an environment of heightened global volatility, or when the shocks are large.",https://www.ecb.europa.eu/pub/pdf/scpwps/ecb.wp2861~8377c4b063.en.pdf?4f956cfa99645a1e49b9392f70ce5599,2861,2-Nov-23,ECB,11/2/2023
Endogenous Labor Supply in an Estimated New-Keynesian Model: Nominal versus Real Rigidities,"Isabel Cairo, Hess Chung, Francesco Ferrante, Cristina Fuentes-Albero, Camilo Morales-Jimenez, Damjan Pfajfar","The deep deterioration in the labor market during the Great Recession, the subsequent slow recovery, and the missing disinflation are hard to reconcile for standard macroeconomic models. We develop and estimate a New-Keynesian model with financial frictions, search and matching frictions in the labor market, and endogenous intensive and extensive labor supply decisions. We conclude that the estimated combination of the low degree of nominal wage rigidities and high degree of real wage rigidities, together with the small role of pre-match costs relative to post-match costs, are key in successfully forecasting the slow recovery in unemployment and the missing disinflation in the aftermath of the Great Recession. We find that endogenous labor supply data are very informative about the relative degree of nominal and real wage rigidities and the slope of the Phillips curve. We also find that none of the model-based labor market gaps are a sufficient statistic of labor market slack, but all contain relevant information about the state of the economy summarized in a new indicator for labor market slack we put forward.",https://www.federalreserve.gov/econres/feds/endogenous-labor-supply-in-an-estimated-new-keynesian-model.htm,2023-069,Nov-23,FED-BOARD,11/3/2023
"Pollution havens? Carbon taxes, globalization, and the geography of emissions","Christofer Schroeder, Livio Stracca","This paper studies the impact of national carbon taxes on CO2 emissions. To do so, we run local projections on a cross-country panel dataset, matching measures of emissions of carbon dioxide with information on the introduction of carbon taxes and their implied price. Importantly, we consider both measures of territorial emissions — emissions emitted within a country’s borders — and consumption emissions — emissions emitted anywhere in the world to satisfy domestic demand. We find that carbon taxes reduce territorial emissions over time, but have no significant effect on consumption emissions. Our estimates are robust to propensity-score weighting adjustments and are driven by countries which are more open to trade. Carbon taxes also lead to a modest increase in imports, suggesting that international trade may imply a negative carbon externality. Together, our findings highlight the limitations of national carbon taxes in isolation and the importance of international cooperation in reducing global emissions.",https://www.ecb.europa.eu/pub/pdf/scpwps/ecb.wp2862~47f293b3f5.en.pdf?f6cd1ae7d0b87e7249261ba83d13fc26,2862,3-Nov-23,ECB,11/3/2023
Relationship discounts incorporate bond trading," Simon Jurkatis, Andreas Schrimpf, Karamfil Todorov, Nicholas Vause",We find that clients with stronger past trading relationships with a dealer receive consistently better prices in corporate bond trading. The top 1% of relationship clients enjoy transaction costs that are 51% lower than those of the median client - an effect which was particularly beneficial when transaction costs spiked during the COVID-19 turmoil.,https://www.bis.org/publ/work1140.htm,https://www.bis.org/publ/work1140,11/3/2023,BIS,11/3/2023
An Alternative Measure of Core Inflation:  The Trimmed Persistence PCE Price Index,John O'Trakoun,"I introduce the ""trimmed persistence PCE,"" a new measure of core inflation in which component prices are weighted according to the time-varying persistence of their price changes. The components of trimmed persistence personal consumption expenditures (PCE) display less tendency to mechanically pass-through the level of the prior period's inflation to the current period; thus, the impact of the current stance of monetary policy and real economic factors are more likely to be visible in recent trimmed persistence inflation compared to headline inflation. Trimmed persistence inflation performs comparably to existing popular measures of core inflation in terms of volatility and relationship with economic slack. Model selection procedures confirm trimmed persistence PCE contributes additional information to inflation forecasting models when stacked against other popular measures of core inflation. Applying the new index in a Taylor rule analysis suggests the Fed's aggressive path of federal funds rate hikes during the pandemic may have achieved appropriately restrictive levels by the fourth quarter of 2022, clearing the way for more measured policy adjustment thereafter as risks of policy overshooting became more salient.",https://www.richmondfed.org/publications/research/working_papers/2023/wp_23-10,23-10,27-Oct-23,FED-RICHMOND,11/3/2023
"Marketing, Other Intangibles, and Output Growth in 61 United States Industries","Leo Sveikauskas, Rachel Soloveichik, Corby Garner, Peter B. Meyer, James Bessen, Mathew Russell","Experts in the System of National Accounts (SNA) recently considered whether marketing could be included as a capital asset in the national accounts and later recommended that marketing should be an intangible in the 2025 SNA (IMF, 2022; IMF, 2023). This paper contributes to that discussion by developing macroeconomic measures of marketing investments and stocks for the United States. We also construct and analyze measures of how marketing and other intangibles contribute to output growth in the 61 industries that comprise the U.S. private business sector.We find that marketing contributes approximately as much to output growth as software and R&D (research and development) do. From 1987 to 2020, our preferred estimates of the annual contribution to output growth are 0.15 percentage point for R&D, 0.19 for software, and 0.18 for marketing. Software grows more rapidly, whereas marketing has a larger factor share. Marketing contributes even more to output if quality is adjusted to allow for better targeting associated with digital advertising. There is a close relationship between data flows, software, and digital marketing, and national accountants must allocate expenditures among these categories.Data File:Marketing Asset DetailXLSX",https://www.bea.gov//index.php/research/papers/2023/marketing-other-intangibles-and-output-growth-61-united-states-industries,WP2023-11,10/31/2023,BEA,11/3/2023
Help wanted: the drivers and implications of labour shortages,"Martin Groiss, David Sondermann","Labour shortages have become prevalent across advanced economies. Yet, little is known about which firms are more likely to face them and the impact they have on the labour market. We create a firm-level data set spanning 28 EU countries, 283 regions and 18 sectors, contributing to close this gap. We find that structural factors play the dominant role. Firms in regions with limited labour supply as well as innovative and fast-growing firms are particularly prone to face labour shortages. Moreover, shortages tend to aggravate at business cycle peaks. In a second stage, we empirically determine the impact of labour shortages on wages and hiring. Firms with higher shortages pay a wage growth premium to keep and attract workers, increasingly so if they face excess demand. At the same time, those are the firms that hire less than the average.",https://www.ecb.europa.eu/pub/pdf/scpwps/ecb.wp2863~c22e538d33.en.pdf?724eb7da06eccc2cf9b60a16edee50be,2863,3-Nov-23,ECB,11/3/2023
